<?xml version="1.0"?>
<!--
To change this license header, choose License Headers in Project Properties.
To change this template file, choose Tools | Templates
and open the template in the editor.
-->

<xs:schema version="1.0"
           targetNamespace="http://quincaillerie"
           xmlns:xs="http://www.w3.org/2001/XMLSchema"
           xmlns="http://quincaillerie"
           elementFormDefault="qualified">
    <xs:include schemaLocation="piece.xsd"/>
    
    <xs:element name="stocks" type="Stocks"/>
    
    <xs:complexType name="Stocks">
        <xs:sequence>
            <xs:element name="stockPiece" type="PieceNombreStock" minOccurs="0" maxOccurs="unbounded"/>
        </xs:sequence>
    </xs:complexType>

</xs:schema>
